{
  "$id": "https://openfairy.local/schemas/protocol/v1/turn.input.json",
  "$schema": "https://json-schema.org/draft/2020-12/schema",
  "additionalProperties": true,
  "properties": {
    "actor": {
      "pattern": "^(user|agent|tool|system|subagent:[A-Za-z0-9_.-]+|workflow:[A-Za-z0-9_.-]+)$",
      "type": "string"
    },
    "id": {
      "pattern": "^evt_[0-9A-HJKMNP-TV-Z]{26}$",
      "type": "string"
    },
    "labels": {
      "additionalProperties": true,
      "properties": {
        "residency": {
          "enum": [
            "local-only",
            "region-restricted",
            "global-ok"
          ],
          "type": "string"
        },
        "sensitivity": {
          "enum": [
            "public",
            "internal",
            "personal",
            "secret"
          ],
          "type": "string"
        }
      },
      "required": [
        "sensitivity",
        "residency"
      ],
      "type": "object"
    },
    "payload": {
      "additionalProperties": true,
      "properties": {
        "channel": {
          "type": "string"
        },
        "content": {
          "items": {
            "oneOf": [
              {
                "additionalProperties": true,
                "properties": {
                  "kind": {
                    "const": "text",
                    "type": "string"
                  },
                  "text": {
                    "minLength": 1,
                    "type": "string"
                  }
                },
                "required": [
                  "kind",
                  "text"
                ],
                "type": "object"
              },
              {
                "additionalProperties": true,
                "properties": {
                  "kind": {
                    "const": "artifact",
                    "type": "string"
                  },
                  "mime": {
                    "minLength": 1,
                    "type": "string"
                  },
                  "ref": {
                    "minLength": 1,
                    "type": "string"
                  }
                },
                "required": [
                  "kind",
                  "ref"
                ],
                "type": "object"
              }
            ]
          },
          "minItems": 1,
          "type": "array"
        }
      },
      "required": [
        "content"
      ],
      "type": "object"
    },
    "provenance": {
      "pattern": "^(user|agent|tool:[^\\s]+|web:[^\\s]+|mcp:[^\\s]+)$",
      "type": "string"
    },
    "sid": {
      "pattern": "^ses_[0-9A-HJKMNP-TV-Z]{26}$",
      "type": "string"
    },
    "ts": {
      "pattern": "^\\d{4}-\\d{2}-\\d{2}T\\d{2}:\\d{2}:\\d{2}\\.\\d{3}Z$",
      "type": "string"
    },
    "turn": {
      "minimum": 0,
      "type": "integer"
    },
    "type": {
      "const": "turn.input"
    },
    "v": {
      "const": 1
    }
  },
  "required": [
    "v",
    "id",
    "sid",
    "turn",
    "ts",
    "actor",
    "type",
    "provenance",
    "labels",
    "payload"
  ],
  "title": "Fairy protocol event turn.input v1",
  "type": "object"
}
