{
  "actor": "agent",
  "id": "evt_01J00000000000000000000000",
  "labels": {
    "residency": "global-ok",
    "sensitivity": "internal"
  },
  "payload": {
    "channel": "cli",
    "content": [
      {
        "kind": "text",
        "text": "Hello Fairy"
      }
    ]
  },
  "provenance": "agent",
  "sid": "ses_01J00000000000000000000000",
  "ts": "2026-07-02T10:00:00.000Z",
  "turn": 1,
  "type": "turn.input",
  "v": 1
}
